{
  "schema_version": "1.0.0",
  "property_id": "USDA_1BEDROOM_001",
  "property_short_code": "USDA001",
  "unit_system": "imperial",
  "rooms": [
    {
      "room_id": "ROOM_001",
      "room_code": "LIVING_001",
      "room_name": "Living Room",
      "room_type": "living_room",
      "floor_level": "level_1",
      "status": "active",
      "source_plan_reference": "PDF floor plan reference; dimensions require CAD/field verification",
      "geometry": {"origin_x": 0, "origin_y": 0, "origin_z": 0, "width": 12, "length": 14, "height": 8, "area_sqft": 168, "perimeter_lf": 52, "floor_area_sqft": 168, "ceiling_area_sqft": 168},
      "envelope": {"wall_type": "mixed", "floor_type": "subfloor", "ceiling_type": "flat", "exterior_exposure": true, "conditioned_space": true},
      "openings": {"doors": [{"door_id": "DR001", "door_type": "entry", "width": 3, "height": 6.67, "wall": "south", "offset_from_corner": 4, "swing_direction": "right_in", "material_package": "fiberglass_entry"}], "windows": [{"window_id": "WN001", "window_type": "double_hung", "width": 3, "height": 4, "sill_height": 3, "wall": "east", "offset_from_corner": 4, "material_package": "vinyl_standard"}]},
      "materials": {"floor_material_id": "MAT_FLOOR_LVP_STANDARD", "wall_material_id": "MAT_WALL_PAINT_WHITE", "ceiling_material_id": "MAT_CEILING_FLAT_WHITE", "trim_material_id": "MAT_TRIM_WHITE_MDF"},
      "mep": {"electrical_zone_id": "ELEC_ZONE_LIVING", "hvac_zone_id": "HVAC_ZONE_1", "has_water": false, "has_gas": false, "has_exhaust": false, "required_outlets": 6, "required_lights": 2},
      "cost_mapping": {"cost_code": "INTERIOR_LIVING", "labor_complexity": "standard", "finish_level": "rental", "estimated_material_cost": 1850, "estimated_labor_cost": 1600, "estimated_total_cost": 3450, "accounting_job_code": "JOB-USDA001-LIVING"},
      "blender_mapping": {"blender_collection": "USDA001_LEVEL1_LIVING", "blender_object_prefix": "USDA001_LIVING_001", "generate_floor": true, "generate_walls": true, "generate_ceiling": true, "generate_openings": true, "default_camera_target": true},
      "notes": "Prototype dimensions. Replace after precise plan takeoff."
    },
    {
      "room_id": "ROOM_002",
      "room_code": "KITCHEN_001",
      "room_name": "Kitchen",
      "room_type": "kitchen",
      "floor_level": "level_1",
      "status": "active",
      "source_plan_reference": "PDF kitchen plan reference; dimensions require CAD/field verification",
      "geometry": {"origin_x": 12, "origin_y": 0, "origin_z": 0, "width": 10, "length": 12, "height": 8, "area_sqft": 120, "perimeter_lf": 44, "floor_area_sqft": 120, "ceiling_area_sqft": 120},
      "envelope": {"wall_type": "mixed", "floor_type": "subfloor", "ceiling_type": "flat", "exterior_exposure": true, "conditioned_space": true},
      "openings": {"doors": [], "windows": [{"window_id": "WN002", "window_type": "double_hung", "width": 3, "height": 3, "sill_height": 3.5, "wall": "north", "offset_from_corner": 3, "material_package": "vinyl_standard"}]},
      "materials": {"floor_material_id": "MAT_FLOOR_LVP_WATERPROOF", "wall_material_id": "MAT_WALL_PAINT_SEMI_GLOSS", "ceiling_material_id": "MAT_CEILING_FLAT_WHITE", "trim_material_id": "MAT_TRIM_WHITE_MDF", "countertop_material_id": "MAT_COUNTER_LAMINATE", "cabinet_material_id": "MAT_CABINET_SHAKER_WHITE"},
      "mep": {"electrical_zone_id": "ELEC_ZONE_KITCHEN", "plumbing_zone_id": "PLUMB_ZONE_KITCHEN", "hvac_zone_id": "HVAC_ZONE_1", "has_water": true, "has_gas": false, "has_exhaust": true, "required_outlets": 8, "required_lights": 3},
      "cost_mapping": {"cost_code": "KITCHEN_STANDARD", "labor_complexity": "complex", "finish_level": "rental", "estimated_material_cost": 7500, "estimated_labor_cost": 6000, "estimated_total_cost": 13500, "accounting_job_code": "JOB-USDA001-KITCHEN"},
      "blender_mapping": {"blender_collection": "USDA001_LEVEL1_KITCHEN", "blender_object_prefix": "USDA001_KITCHEN_001", "generate_floor": true, "generate_walls": true, "generate_ceiling": true, "generate_openings": true, "default_camera_target": false},
      "notes": "Cabinet/appliance layout to be refined after plan takeoff."
    },
    {
      "room_id": "ROOM_004",
      "room_code": "BEDROOM_001",
      "room_name": "Bedroom",
      "room_type": "bedroom",
      "floor_level": "level_1",
      "status": "active",
      "source_plan_reference": "PDF bedroom plan reference; dimensions require CAD/field verification",
      "geometry": {"origin_x": 0, "origin_y": 14, "origin_z": 0, "width": 12, "length": 12, "height": 8, "area_sqft": 144, "perimeter_lf": 48, "floor_area_sqft": 144, "ceiling_area_sqft": 144},
      "envelope": {"wall_type": "mixed", "floor_type": "subfloor", "ceiling_type": "flat", "exterior_exposure": true, "conditioned_space": true},
      "openings": {"doors": [{"door_id": "DR003", "door_type": "interior", "width": 2.5, "height": 6.67, "wall": "south", "offset_from_corner": 1, "swing_direction": "left_in", "material_package": "hollow_core"}], "windows": [{"window_id": "WN003", "window_type": "egress", "width": 3, "height": 4, "sill_height": 3, "wall": "west", "offset_from_corner": 4, "material_package": "vinyl_standard"}]},
      "materials": {"floor_material_id": "MAT_FLOOR_CARPET_STANDARD", "wall_material_id": "MAT_WALL_PAINT_WHITE", "ceiling_material_id": "MAT_CEILING_FLAT_WHITE", "trim_material_id": "MAT_TRIM_WHITE_MDF"},
      "mep": {"electrical_zone_id": "ELEC_ZONE_BEDROOM", "hvac_zone_id": "HVAC_ZONE_1", "has_water": false, "has_gas": false, "has_exhaust": false, "required_outlets": 5, "required_lights": 1},
      "cost_mapping": {"cost_code": "BEDROOM_STANDARD", "labor_complexity": "standard", "finish_level": "rental", "estimated_material_cost": 1600, "estimated_labor_cost": 1400, "estimated_total_cost": 3000, "accounting_job_code": "JOB-USDA001-BEDROOM"},
      "blender_mapping": {"blender_collection": "USDA001_LEVEL1_BEDROOM", "blender_object_prefix": "USDA001_BEDROOM_001", "generate_floor": true, "generate_walls": true, "generate_ceiling": true, "generate_openings": true, "default_camera_target": false},
      "notes": "Bedroom must maintain egress compliance."
    },
    {
      "room_id": "ROOM_005",
      "room_code": "BATH_001",
      "room_name": "Bathroom",
      "room_type": "bathroom",
      "floor_level": "level_1",
      "status": "active",
      "source_plan_reference": "PDF bathroom reference; dimensions require CAD/field verification",
      "geometry": {"origin_x": 12, "origin_y": 12, "origin_z": 0, "width": 8, "length": 8, "height": 8, "area_sqft": 64, "perimeter_lf": 32, "floor_area_sqft": 64, "ceiling_area_sqft": 64},
      "envelope": {"wall_type": "interior", "floor_type": "subfloor", "ceiling_type": "flat", "exterior_exposure": false, "conditioned_space": true},
      "openings": {"doors": [{"door_id": "DR004", "door_type": "interior", "width": 2.5, "height": 6.67, "wall": "west", "offset_from_corner": 1, "swing_direction": "right_in", "material_package": "hollow_core"}], "windows": []},
      "materials": {"floor_material_id": "MAT_FLOOR_TILE_STANDARD", "wall_material_id": "MAT_WALL_PAINT_BATH_SEMI_GLOSS", "ceiling_material_id": "MAT_CEILING_MOISTURE_RESISTANT", "trim_material_id": "MAT_TRIM_PVC_WHITE", "countertop_material_id": "MAT_COUNTER_CULTURED_MARBLE", "cabinet_material_id": "MAT_VANITY_STANDARD"},
      "mep": {"electrical_zone_id": "ELEC_ZONE_BATH", "plumbing_zone_id": "PLUMB_ZONE_BATH", "hvac_zone_id": "HVAC_ZONE_1", "has_water": true, "has_gas": false, "has_exhaust": true, "required_outlets": 2, "required_lights": 2},
      "cost_mapping": {"cost_code": "BATH_STANDARD", "labor_complexity": "complex", "finish_level": "rental", "estimated_material_cost": 5200, "estimated_labor_cost": 4800, "estimated_total_cost": 10000, "accounting_job_code": "JOB-USDA001-BATH"},
      "blender_mapping": {"blender_collection": "USDA001_LEVEL1_BATH", "blender_object_prefix": "USDA001_BATH_001", "generate_floor": true, "generate_walls": true, "generate_ceiling": true, "generate_openings": true, "default_camera_target": false},
      "notes": "Bathroom requires plumbing and exhaust coordination."
    }
  ]
}
